{
  "observationBindingVersion": "sourcegraph-observation-binding/v1",
  "graph": {
    "graphIdentityVersion": "sourcegraph-identity/v2",
    "graphSchemaVersion": "acp6-sourcegraph/v1",
    "relationIdentityVersion": "relation-id/v1",
    "projectId": "project-demo",
    "sourceDigest": "0000000000000000000000000000000000000000000000000000000000000000",
    "graphDigest": "ff8735ed6e3ff1f8321f66c2263d37c243ad7ec36616f28b98406fdc6ebcb9fe"
  },
  "sourceRef": "node:a",
  "sourceUseRef": {
    "sourceRef": "node:a",
    "graphNodeId": "node:a",
    "sourceUse": {"path": "src/a.css", "charOffset": 4, "byteOffset": 4, "offsetUnit": "code-unit"}
  },
  "runId": "run-1",
  "checkId": "check-home-390",
  "side": "baseline",
  "route": "/home?x=1#hero",
  "page": {"pathname": "/home", "search": "?x=1", "hash": "#hero"},
  "viewport": {"width": 390, "height": 844, "deviceScaleFactor": 1},
  "state": {"id": "default"},
  "artifact": {"kind": "observation-json", "path": "runs/run-1/check-home-390/baseline.json", "sha256": "1111111111111111111111111111111111111111111111111111111111111111", "sizeBytes": 128},
  "status": "partial",
  "proof": "not-proven",
  "primaryReasonCode": "observation/missing-relation-id",
  "secondaryReasonCodes": [],
  "observationBindingDigest": "not-computed-in-fixture"
}
